B1: Republicans | C1: Democrats | D1: Totals
A2: 39423 | B2: 58939 | C2: 19942 | D2: =SUM(B2:C2) -> 78881
A3: 39424 | B3: 76376 | C3: 38708 | D3: =SUM(B3:C3) -> 115084
A4: 39425 | B4: 74966 | C4: 45861 | D4: =SUM(B4:C4) -> 120827
A5: 39426 | B5: 62073 | C5: 41298 | D5: =SUM(B5:C5) -> 103371
A6: 39427 | B6: 44376 | C6: 27951 | D6: =SUM(B6:C6) -> 72327
A7: Totals | B7: =SUM(B2:B6) -> 316730 | C7: =SUM(C2:C6) -> 173760 | D7: =SUM(D2:D6) -> 490490
B9: Republicans | C9: Democrats | D9: Totals
A10: 39423 | B10: =B2/D2 -> 0.74718880338738103 | C10: =C2/D2 -> 0.25281119661261903 | D10: =SUM(B10:C10) -> 1
A11: 39424 | B11: =B3/D3 -> 0.66365437419623929 | C11: =C3/D3 -> 0.33634562580376071 | D11: =SUM(B11:C11) -> 1
A12: 39425 | B12: =B4/D4 -> 0.62044079551755815 | C12: =C4/D4 -> 0.37955920448244185 | D12: =SUM(B12:C12) -> 1
A13: 39426 | B13: =B5/D5 -> 0.60048756421046523 | C13: =C5/D5 -> 0.39951243578953477 | D13: =SUM(B13:C13) -> 1
A14: 39427 | B14: =B6/D6 -> 0.61354680824588326 | C14: =C6/D6 -> 0.38645319175411674 | D14: =SUM(B14:C14) -> 1
B16: Republicans | C16: Democrats | D16: Totals
A17: Total | B17: =B7/D7 -> 0.64574201308895185 | C17: =C7/D7 -> 0.35425798691104815 | D17: =SUM(B17:C17) -> 1