B1: Barack Obama | C1: Hillary Clinton | D1: John Edwards | E1: Dennis Kucinich | F1: Bill Richardson | G1: Joe Biden | H1: Mike Gravel | I1: Chris Dodd | J1: Totals
A2: 39423 | B2: 9761 | C2: 4512 | D2: 2271 | E2: 1206 | F2: 604 | G2: 825 | H2: 426 | I2: 337 | J2: =SUM(B2:I2) -> 19942
A3: 39424 | B3: 16995 | C3: 9982 | D3: 5236 | E3: 2572 | F3: 1256 | G3: 1443 | H3: 740 | I3: 484 | J3: =SUM(B3:I3) -> 38708
A4: 39425 | B4: 21515 | C4: 12674 | D4: 4096 | E4: 2435 | F4: 1541 | G4: 1994 | H4: 941 | I4: 665 | J4: =SUM(B4:I4) -> 45861
A5: 39426 | B5: 17775 | C5: 12180 | D5: 3891 | E5: 2201 | F5: 1597 | G5: 1694 | H5: 919 | I5: 1041 | J5: =SUM(B5:I5) -> 41298
A6: 39427 | B6: 10731 | C6: 8630 | D6: 3047 | E6: 1512 | F6: 1197 | G6: 1412 | H6: 685 | I6: 737 | J6: =SUM(B6:I6) -> 27951
A7: Total | B7: =SUM(B2:B6) -> 76777 | C7: =SUM(C2:C6) -> 47978 | D7: =SUM(D2:D6) -> 18541 | E7: =SUM(E2:E6) -> 9926 | F7: =SUM(F2:F6) -> 6195 | G7: =SUM(G2:G6) -> 7368 | H7: =SUM(H2:H6) -> 3711 | I7: =SUM(I2:I6) -> 3264 | J7: =SUM(J2:J6) -> 173760
B9: Barack Obama | C9: Hillary Clinton | D9: John Edwards | E9: Dennis Kucinich | F9: Bill Richardson | G9: Joe Biden | H9: Mike Gravel | I9: Chris Dodd | J9: Totals
A10: 39423 | B10: =B2/J2 -> 0.48946946143817072 | C10: =C2/J2 -> 0.22625614281416107 | D10: =D2/J2 -> 0.11388025273292549 | E10: =E2/J2 -> 6.0475378597934011E-2 | F10: =F2/J2 -> 3.028783472069E-2 | G10: =G2/J2 -> 4.1369972921472271E-2 | H10: =H2/J2 -> 2.1361949653996591E-2 | I10: =I2/J2 -> 1.6899007120649883E-2 | J10: =SUM(B10:I10) -> 1
A11: 39424 | B11: =B3/J3 -> 0.43905652578278392 | C11: =C3/J3 -> 0.25787950811201821 | D11: =D3/J3 -> 0.13526919499844994 | E11: =E3/J3 -> 6.644621266921566E-2 | F11: =F3/J3 -> 3.244807274981916E-2 | G11: =G3/J3 -> 3.727911542833523E-2 | H11: =H3/J3 -> 1.9117495091453964E-2 | I11: =I3/J3 -> 1.2503875167923943E-2 | J11: =SUM(B11:I11) -> 1
A12: 39425 | B12: =B4/J4 -> 0.46913499487582039 | C12: =C4/J4 -> 0.27635681733935152 | D12: =D4/J4 -> 8.9313359935457137E-2 | E12: =E4/J4 -> 5.3095222520224153E-2 | F12: =F4/J4 -> 3.3601535073373892E-2 | G12: =G4/J4 -> 4.3479208913891981E-2 | H12: =H4/J4 -> 2.051852336407841E-2 | I12: =I4/J4 -> 1.450033797780249E-2 | J12: =SUM(B12:I12) -> 1
A13: 39426 | B13: =B5/J5 -> 0.43040825221560364 | C13: =C5/J5 -> 0.29492953653929971 | D13: =D5/J5 -> 9.4217637657997969E-2 | E13: =E5/J5 -> 5.3295559106978543E-2 | F13: =F5/J5 -> 3.8670153518330183E-2 | G13: =G5/J5 -> 4.101893554167272E-2 | H13: =H5/J5 -> 2.2252893602595768E-2 | I13: =I5/J5 -> 2.520703181752143E-2 | J13: =SUM(B13:I13) -> 1
A14: 39427 | B14: =B6/J6 -> 0.38392186326070621 | C14: =C6/J6 -> 0.30875460627526741 | D14: =D6/J6 -> 0.10901219992129083 | E14: =E6/J6 -> 5.4094665664913597E-2 | F14: =F6/J6 -> 4.2824943651389932E-2 | G14: =G6/J6 -> 5.0516976136810846E-2 | H14: =H6/J6 -> 2.4507173267503846E-2 | I14: =I6/J6 -> 2.6367571822117276E-2 | J14: =SUM(B14:I14) -> 1
B16: Barack Obama | C16: Hillary Clinton | D16: John Edwards | E16: Dennis Kucinich | F16: Bill Richardson | G16: Joe Biden | H16: Mike Gravel | I16: Chris Dodd | J16: Totals
A17: Total | B17: =B7/J7 -> 0.44185658379373849 | C17: =C7/J7 -> 0.27611648250460408 | D17: =D7/J7 -> 0.10670465009208104 | E17: =E7/J7 -> 5.7124769797421732E-2 | F17: =F7/J7 -> 3.5652624309392263E-2 | G17: =G7/J7 -> 4.2403314917127073E-2 | H17: =H7/J7 -> 2.1357044198895028E-2 | I17: =I7/J7 -> 1.8784530386740331E-2 | J17: =SUM(B17:I17) -> 1