B1: Ron Paul | C1: Mike Huckabee | D1: Mitt Romney | E1: Rudy Giuliani | F1: Fred Thompson | G1: John McCain | H1: Duncan Hunter | I1: Tom Tancredo | J1: Totals
A2: 39423 | B2: 20198 | C2: 15063 | D2: 9003 | E2: 8761 | F2: 1367 | G2: 3554 | H2: 486 | I2: 507 | J2: 58939
A3: 39424 | B3: 35783 | C3: 22193 | D3: 7060 | E3: 5222 | F3: 2429 | G3: 2019 | H3: 860 | I3: 810 | J3: 76376
A4: 39425 | B4: 37872 | C4: 13414 | D4: 8584 | E4: 6581 | F4: 3605 | G4: 2359 | H4: 1324 | I4: 1227 | J4: 74966
A5: 39426 | B5: 28416 | C5: 11692 | D5: 7687 | E5: 5723 | F5: 3608 | G5: 2607 | H5: 1164 | I5: 1176 | J5: 62073
A6: 39427 | B6: 19603 | C6: 8945 | D6: 5213 | E6: 4327 | F6: 2645 | G6: 2038 | H6: 885 | I6: 720 | J6: 44376
A7: Total | B7: =SUM(B2:B6) -> 141872 | C7: =SUM(C2:C6) -> 71307 | D7: =SUM(D2:D6) -> 37547 | E7: =SUM(E2:E6) -> 30614 | F7: =SUM(F2:F6) -> 13654 | G7: =SUM(G2:G6) -> 12577 | H7: =SUM(H2:H6) -> 4719 | I7: =SUM(I2:I6) -> 4440 | J7: =SUM(J2:J6) -> 316730
B9: Ron Paul | C9: Mike Huckabee | D9: Mitt Romney | E9: Rudy Giuliani | F9: Fred Thompson | G9: John McCain | H9: Duncan Hunter | I9: Tom Tancredo | J9: Totals
A10: 39423 | B10: 0.342693293065712 | C10: 0.25556931742988515 | D10: 0.15275114949354418 | E10: 0.1486452094538421 | F10: 2.3193471216002987E-2 | G10: 6.0299631822731979E-2 | H10: 8.2458134681619982E-3 | I10: 8.602114050119616E-3 | J10: 1
A11: 39424 | B11: 0.46851105059180892 | C11: 0.29057557347857965 | D11: 9.2437414894731326E-2 | E11: 6.8372263538284281E-2 | F11: 3.1803184246360111E-2 | G11: 2.6435005760972033E-2 | H11: 1.1260081701057923E-2 | I11: 1.0605425788205719E-2 | J11: 1
A12: 39425 | B12: 0.50518901902195668 | C12: 0.1789344502841288 | D12: 0.11450524237654404 | E12: 8.778646319664915E-2 | F12: 4.8088466771603125E-2 | G12: 3.1467598644718937E-2 | H12: 1.7661339807379346E-2 | I12: 1.6367419897019984E-2 | J12: 1
A13: 39426 | B13: 0.45778357740080228 | C13: 0.18835886778470509 | D13: 0.1238380616371047 | E13: 9.2197896025647222E-2 | F13: 5.8125110756689705E-2 | G13: 4.1998936735778841E-2 | H13: 1.875211444589435E-2 | I13: 1.8945435213377798E-2 | J13: 1
A14: 39427 | B14: 0.44174779159906258 | C14: 0.20157292230034252 | D14: 0.1174734090499369 | E14: 9.7507661799170725E-2 | F14: 5.9604290607535602E-2 | G14: 4.5925725617450876E-2 | H14: 1.9943212547322876E-2 | I14: 1.6224986479177934E-2 | J14: 1
B16: Ron Paul | C16: Mike Huckabee | D16: Mitt Romney | E16: Rudy Giuliani | F16: Fred Thompson | G16: John McCain | H16: Duncan Hunter | I16: Tom Tancredo | J16: Totals
A17: Total | B17: =B7/J7 -> 0.44792725665393235 | C17: =C7/J7 -> 0.22513497300539892 | D17: =D7/J7 -> 0.11854576453130426 | E17: =E7/J7 -> 9.6656458182047794E-2 | F17: =F7/J7 -> 4.3109272882265653E-2 | G17: =G7/J7 -> 3.9708900325198117E-2 | H17: =H7/J7 -> 1.4899125438070281E-2 | I17: =I7/J7 -> 1.4018248981782592E-2 | J17: =SUM(B17:I17) -> 1